{
  "$schema": "http://json-schema.org/draft-07/schema#",
  "$id": "https://portx.io/schema/portx.json",
  "title": "PORTX Package Schema",
  "description": "Schema for PORTX portx.json files",
  "type": "object",
  "required": [
    "name",
    "version",
    "description",
    "importType"
  ],
  "properties": {
    "name": {
      "type": "string",
      "pattern": "^[a-z0-9]([a-z0-9-])*[a-z0-9]?$",
      "description": "Package name (lowercase, alphanumeric with hyphens)"
    },
    "version": {
      "type": "string",
      "pattern": "^\\d+\\.\\d+\\.\\d+$",
      "description": "Semantic version (major.minor.patch)"
    },
    "description": {
      "type": "string",
      "minLength": 10,
      "description": "Brief package description (minimum 10 characters)"
    },
    "importType": {
      "type": "string",
      "enum": [
        "wrap",
        "path",
        "none",
        "wrapAndPath"
      ],
      "description": "Import strategy: wrap (create wrappers with intelligent PATH detection), path (add package root to PATH), none (documentation only, no imports), wrapAndPath (create wrappers AND add to PATH for maximum compatibility)"
    },
    "bin": {
      "type": "object",
      "patternProperties": {
        "^[a-z0-9-]+$": {
          "type": "object",
          "required": [
            "path",
            "description",
            "tags"
          ],
          "properties": {
            "path": {
              "type": "string",
              "pattern": "^[^/].*\\.(exe|cmd|bat|sh)$",
              "description": "Executable path from package root (e.g., bin/tool.exe or tool.exe)"
            },
            "description": {
              "type": "string",
              "minLength": 10,
              "description": "Tool description (minimum 10 characters)"
            },
            "usage": {
              "type": "string",
              "description": "Usage examples and command patterns"
            },
            "dependencies": {
              "type": "string",
              "enum": [
                "windows",
                "linux",
                "cross-platform",
                "native"
              ],
              "default": "windows",
              "description": "Platform dependencies"
            },
            "tags": {
              "type": "array",
              "items": {
                "type": "string",
                "enum": [
                  "admin-tool",
                  "advanced",
                  "alerting",
                  "analysis",
                  "analysis-tool",
                  "analyzer",
                  "ansi-output",
                  "api",
                  "api-tool",
                  "archive-tool",
                  "archiver",
                  "archiving",
                  "ast-output",
                  "async",
                  "audio-processing",
                  "audio-tool",
                  "audit",
                  "audit-tool",
                  "auditing",
                  "authentication",
                  "authorization",
                  "automatable",
                  "automate",
                  "automation",
                  "backup",
                  "backup-recovery",
                  "backup-tool",
                  "basic",
                  "batch",
                  "batch-processing",
                  "beginner",
                  "bench-tool",
                  "benchmark",
                  "benchmark-testing",
                  "benchmarker",
                  "benchmarking",
                  "binary-analysis",
                  "binary-input",
                  "binary-output",
                  "binary-tool",
                  "bridge",
                  "browse",
                  "browser",
                  "browser-tool",
                  "build",
                  "build-tool",
                  "builder",
                  "building",
                  "capacity-planning",
                  "capture",
                  "capture-tool",
                  "capturer",
                  "centralized",
                  "change-management",
                  "check",
                  "ci-cd",
                  "clean",
                  "cli",
                  "client",
                  "client-tool",
                  "cloud-management",
                  "cloud-tool",
                  "code-analysis",
                  "code-input",
                  "code-review",
                  "coding",
                  "collaboration",
                  "command-output",
                  "commercial",
                  "communication",
                  "compare",
                  "compilation",
                  "compile",
                  "compiled-output",
                  "compiler",
                  "complex",
                  "compliance",
                  "compliance-checking",
                  "comprehensive",
                  "compress",
                  "compress-tool",
                  "compression",
                  "compressor",
                  "config-input",
                  "config-tool",
                  "configurable",
                  "configuration",
                  "configuration-management",
                  "configure",
                  "container",
                  "containerization",
                  "content-search",
                  "control",
                  "convert",
                  "convert-tool",
                  "converter",
                  "create",
                  "cross-platform",
                  "crypto-tool",
                  "csv-input",
                  "csv-output",
                  "csv-tool",
                  "customizable",
                  "data",
                  "data-analysis",
                  "data-migration",
                  "data-processing",
                  "data-tool",
                  "data-visualization",
                  "database",
                  "db-tool",
                  "debug",
                  "debug-tool",
                  "debugging",
                  "decode",
                  "decrypt",
                  "dependency-management",
                  "deploy",
                  "deploy-tool",
                  "deployer",
                  "deployment",
                  "deprecated",
                  "dev-tool",
                  "development",
                  "devops",
                  "diagnose",
                  "diff",
                  "diff-tool",
                  "digital-forensics",
                  "directory-input",
                  "directory-output",
                  "directory-traversal",
                  "disaster-recovery",
                  "discover",
                  "disk-analysis",
                  "distributed",
                  "dns-resolution",
                  "docker-tool",
                  "docs-tool",
                  "documentation",
                  "documenting",
                  "download",
                  "downloader",
                  "dynamic-analysis",
                  "edit",
                  "editor",
                  "editor-tool",
                  "encode",
                  "encrypt",
                  "encryption",
                  "encryptor",
                  "enterprise",
                  "executable-input",
                  "executable-output",
                  "experimental",
                  "expert",
                  "explore",
                  "extensible",
                  "extract",
                  "extraction",
                  "extractor",
                  "fast",
                  "file-analysis",
                  "file-input",
                  "file-management",
                  "file-output",
                  "file-tool",
                  "filesystem",
                  "filesystem-input",
                  "filter",
                  "find",
                  "fix",
                  "forensic-analysis",
                  "forensics",
                  "format",
                  "format-conversion",
                  "format-tool",
                  "formatted-output",
                  "formatting",
                  "forward",
                  "free",
                  "full-featured",
                  "general-purpose",
                  "generate",
                  "generator",
                  "gif-output",
                  "git",
                  "git-input",
                  "git-tool",
                  "graphics",
                  "graphics-tool",
                  "grep",
                  "gui",
                  "hardening",
                  "hash",
                  "hasher",
                  "heavyweight",
                  "high-performance",
                  "html-output",
                  "http-input",
                  "image-input",
                  "image-processing",
                  "image-tool",
                  "incident-response",
                  "incremental",
                  "infrastructure-as-code",
                  "inspect",
                  "install",
                  "installer",
                  "integration",
                  "interactive",
                  "interactive-input",
                  "interactive-output",
                  "interface-input",
                  "intermediate",
                  "issue-tracking",
                  "join",
                  "json-input",
                  "json-output",
                  "json-tool",
                  "k8s-tool",
                  "kafka-input",
                  "keyboard-input",
                  "knowledge-management",
                  "large",
                  "launcher",
                  "legacy",
                  "lightweight",
                  "linting",
                  "live-input",
                  "load-testing",
                  "local",
                  "log",
                  "log-analysis",
                  "log-tool",
                  "logging",
                  "malware",
                  "malware-analysis",
                  "manage",
                  "manager",
                  "match-output",
                  "mature",
                  "media",
                  "media-input",
                  "media-processing",
                  "media-tool",
                  "memory-analysis",
                  "memory-input",
                  "merge",
                  "merge-tool",
                  "metadata-analysis",
                  "metrics-collection",
                  "metrics-output",
                  "migration",
                  "minimal",
                  "mirroring",
                  "modern",
                  "modular",
                  "monitor",
                  "monitor-tool",
                  "monitoring",
                  "native",
                  "navigate",
                  "navigation",
                  "navigator",
                  "network-analysis",
                  "network-input",
                  "network-output",
                  "network-scanning",
                  "network-tool",
                  "networking",
                  "notification",
                  "offline",
                  "online",
                  "open-source",
                  "ops-tool",
                  "optimize",
                  "optimizer",
                  "orchestration",
                  "packaging",
                  "packer",
                  "packet-analysis",
                  "packet-capture",
                  "parse",
                  "parser-tool",
                  "parsing",
                  "path-output",
                  "pattern-matching",
                  "pcap-input",
                  "pcap-output",
                  "penetration-testing",
                  "performance",
                  "performance-analysis",
                  "performance-testing",
                  "play",
                  "player",
                  "portable",
                  "process-analysis",
                  "process-input",
                  "process-output",
                  "processor",
                  "productivity",
                  "profile",
                  "profile-tool",
                  "profiler",
                  "profiling",
                  "project-input",
                  "project-management",
                  "protect",
                  "protocol-analysis",
                  "proxy",
                  "proxy-tool",
                  "quality-assurance",
                  "querying",
                  "real-time-processing",
                  "realtime",
                  "record",
                  "recorder",
                  "recovery",
                  "refactoring",
                  "registry-analysis",
                  "release-management",
                  "reliable",
                  "remote",
                  "repair",
                  "replication",
                  "report-output",
                  "reporting",
                  "resource-monitoring",
                  "restore",
                  "reverse-engineering",
                  "route",
                  "rule-input",
                  "runner",
                  "scan",
                  "scanner",
                  "scanner-tool",
                  "schema-input",
                  "script-input",
                  "scriptable",
                  "search",
                  "search-tool",
                  "searcher",
                  "secure",
                  "security",
                  "security-analysis",
                  "security-scanning",
                  "security-tool",
                  "serve",
                  "server",
                  "server-tool",
                  "shell-output",
                  "sign",
                  "simple",
                  "slow",
                  "small",
                  "sniffer",
                  "sort",
                  "specialized",
                  "split",
                  "sql-input",
                  "ssh-input",
                  "stable",
                  "static-analysis",
                  "stdin-input",
                  "stdout-output",
                  "stream",
                  "stream-input",
                  "stream-processing",
                  "stream-tool",
                  "streaming",
                  "stress-testing",
                  "sync",
                  "sync-tool",
                  "synchronization",
                  "synchronizer",
                  "system-administration",
                  "system-tool",
                  "table-output",
                  "task-scheduling",
                  "terminal-input",
                  "terminal-output",
                  "terminal-tool",
                  "test",
                  "test-tool",
                  "tester",
                  "testing",
                  "text-input",
                  "text-processing",
                  "text-tool",
                  "trace",
                  "trace-tool",
                  "tracer",
                  "tracing",
                  "traffic-analysis",
                  "traffic-monitoring",
                  "transfer",
                  "transfer-tool",
                  "transform",
                  "tree-output",
                  "troubleshoot",
                  "tui",
                  "tui-output",
                  "tunnel",
                  "tunnel-tool",
                  "upload",
                  "uploader",
                  "url-input",
                  "validate",
                  "validation-output",
                  "validator",
                  "verify",
                  "version-control",
                  "video-output",
                  "video-processing",
                  "video-tool",
                  "view",
                  "viewer",
                  "viewer-tool",
                  "virtualization",
                  "visualization",
                  "vulnerability",
                  "vulnerability-assessment",
                  "vulnerability-scanning",
                  "watch",
                  "web",
                  "web-scraping",
                  "web-tool",
                  "windows",
                  "workflow-automation",
                  "xml-input",
                  "xml-output",
                  "xml-tool",
                  "yaml-input",
                  "yaml-tool"
                ]
              },
              "uniqueItems": true,
              "minItems": 10,
              "maxItems": 15,
              "description": "Tool categorization tags (10-15 required covering input, output, functionality, and characteristics)"
            }
          },
          "additionalProperties": false
        }
      },
      "additionalProperties": false,
      "description": "Executable tools in this package"
    }
  },
  "additionalProperties": false,
  "anyOf": [
    {
      "if": {
        "properties": {
          "importType": {
            "const": "wrap"
          }
        }
      },
      "then": {
        "required": [
          "bin"
        ],
        "properties": {
          "bin": {
            "minProperties": 1
          }
        }
      }
    },
    {
      "if": {
        "properties": {
          "importType": {
            "const": "wrapAndPath"
          }
        }
      },
      "then": {
        "required": [
          "bin"
        ],
        "properties": {
          "bin": {
            "minProperties": 1
          }
        }
      }
    },
    true
  ]
}