{
  "name": "miniserve",
  "version": "0.31.0",
  "description": "Instant HTTP file server - serve files and directories over HTTP right now",
  "importType": "wrap",
  "bin": {
    "miniserve": {
      "path": "miniserve.exe",
      "description": "Fast, self-contained HTTP file server written in Rust - perfect for quick file sharing",
      "usage": "miniserve .\nminiserve --port 8080 /path/to/files\nminiserve --upload-files /tmp\nminiserve --auth user:pass ./docs",
      "dependencies": "windows",
      "tags": [
        "cli",
        "file-input",
        "network-output",
        "development",
        "testing",
        "portable",
        "windows"
      ]
    }
  }
}