{
  "name": "par2",
  "version": "1.0.0",
  "description": "Parity archive tool for creating error-correcting recovery files to protect against data corruption",
  "importType": "wrap",
  "bin": {
    "par2": {
      "path": "par2.exe",
      "description": "Create and use parity files for error detection and correction to recover damaged or missing files",
      "usage": "par2 create archive.par2 file1.txt file2.txt\npar2 verify archive.par2\npar2 repair archive.par2\npar2 create -r5 archive.par2 *.jpg",
      "dependencies": "windows",
      "tags": [
        "cli",
        "backup",
        "archiver",
        "file-input",
        "directory-input",
        "file-output",
        "stdout-output",
        "automation",
        "windows"
      ]
    }
  }
}