{
  "name": "maven",
  "version": "3.9.11",
  "description": "Apache Maven build automation and project management tool for Java with dependency management and lifecycle support",
  "importType": "wrap",
  "bin": {
    "mvn": {
      "path": "bin/mvn.cmd",
      "description": "Maven build automation tool for Java projects with dependency management, compilation, testing, and deployment",
      "usage": "mvn clean install | mvn dependency:tree | mvn compile test | mvn package -DskipTests",
      "dependencies": "windows",
      "tags": [
        "cli",
        "automation",
        "manager",
        "development",
        "compilation",
        "testing",
        "deployment",
        "file-input",
        "stdout-output",
        "network-input"
      ]
    },
    "mvnDebug": {
      "path": "bin/mvnDebug.cmd",
      "description": "Maven with debug mode enabled for troubleshooting builds and plugin development",
      "usage": "mvnDebug clean compile | mvnDebug test | mvnDebug -X clean install",
      "dependencies": "windows",
      "tags": [
        "cli",
        "development",
        "compilation",
        "file-input",
        "stdout-output",
        "network-input"
      ]
    }
  }
}