{
  "name": "lizard",
  "version": "1.17.10",
  "description": "Code complexity analyzer for C/C++, Java, JavaScript, Python, Ruby, Swift, Objective-C - Cyclomatic complexity metrics",
  "importType": "wrap",
  "bin": {
    "lizard": {
      "path": "lizard.bat",
      "description": "Multi-language code complexity analyzer with cyclomatic complexity metrics and detailed reports",
      "usage": "lizard src/ | lizard --xml src/ | lizard --CCN 15 --length 1000 src/",
      "dependencies": "native",
      "tags": [
        "cli",
        "analyzer",
        "file-input",
        "xml-output",
        "stdout-output",
        "development"
      ]
    }
  }
}