{
  "name": "gojq",
  "version": "0.12.16",
  "description": "Pure Go implementation of jq with superior Unicode handling, arbitrary-precision integers, and YAML support - handles large numbers without precision loss",
  "importType": "wrap",
  "bin": {
    "gojq": {
      "path": "gojq.exe",
      "description": "Pure Go jq implementation with enhanced Unicode support, arbitrary-precision arithmetic, and YAML input/output - maintains precision for large integers unlike standard jq",
      "usage": "gojq '.users[] | select(.age > 21)' data.json\necho '{\"large\": 12345678901234567890}' | gojq '.large' # Preserves precision\ngojq --yaml-input --yaml-output '.services.web' docker-compose.yml\necho '[1,2,3]' | gojq 'map(. * 999999999999999999999)' # Arbitrary precision math\ngojq '.items | length' huge-file.json # Consistent Unicode character counting",
      "dependencies": "windows",
      "tags": [
        "cli",
        "processor",
        "file-input",
        "stdin-input",
        "stdout-output"
      ]
    }
  }
}