{
  "name": "mediainfo",
  "version": "1.0.0",
  "description": "Comprehensive multimedia file analysis tool for extracting technical and metadata information",
  "importType": "wrap",
  "bin": {
    "mediainfo": {
      "path": "MediaInfo.exe",
      "description": "Extract detailed technical and metadata information from video, audio, and image files",
      "usage": "mediainfo video.mp4\nmediainfo --Output=JSON video.mp4\nmediainfo --Output=XML audio.mp3\nmediainfo --Inform=\"General;%Duration%\" video.avi",
      "dependencies": "windows",
      "tags": [
        "cli",
        "analyzer",
        "file-input",
        "stdout-output",
        "json-output",
        "xml-output",
        "forensics"
      ]
    }
  }
}