{
  "name": "helmfile",
  "version": "1.0.0",
  "description": "Declarative Helm chart deployment tool with environment management",
  "importType": "wrap",
  "bin": {
    "helmfile": {
      "path": "helmfile.exe",
      "description": "Declarative Helm chart deployment tool with environment management",
      "usage": "helmfile apply # Deploy all charts\nhelmfile -e production apply # Deploy to specific environment\nhelmfile diff # Show deployment differences\nhelmfile destroy # Remove all releases\nhelmfile template # Render templates locally",
      "dependencies": "windows",
      "tags": [
        "cli",
        "container",
        "deployment",
        "manager",
        "config-input",
        "file-input",
        "automation"
      ]
    }
  }
}