{
  "name": "hexyl",
  "version": "0.14.0",
  "description": "Modern colorized hex viewer with intelligent byte categorization - distinguishes NULL, ASCII printable, whitespace, and non-ASCII bytes",
  "importType": "wrap",
  "bin": {
    "hexyl": {
      "path": "hexyl.exe",
      "description": "Modern command-line hex viewer with colorized output for binary file analysis - written in Rust with high performance and intelligent byte categorization",
      "usage": "hexyl firmware.bin # View binary file with colors\nhexyl --no-color data.bin # Plain output for scripting\nhexyl --raw binary.exe # Compact view without addresses\nhexyl --length 1024 large.bin # View first 1KB only",
      "dependencies": "windows",
      "tags": [
        "cli",
        "viewer",
        "file-input",
        "stdout-output",
        "analyzer",
        "forensics"
      ]
    }
  }
}